{
  "$schema": "http://json-schema.org/draft-07/schema#",
  "$id": "https://linkdesk.local/schemas/theme.schema.json",
  "title": "LinkDesk theme definition (ThemeRecipe)",
  "description": "Contract for the theme JSON file referenced by contributes.themes (modeled on plugin.schema.json; format errors are rejected on the spot). Mirrors the ThemeRecipe type in src/core/types/theme.ts; parsing semantics live in parseThemeRecipe. The new format requires colorways[] (the engine reads only the new format); appearance domains are sparse, and an omitted domain inherits the shell's :root default. Validated by scripts/check-theme-schema.mjs (part of the npm run check chain).",
  "type": "object",
  "required": ["id", "name", "type", "colorways"],
  "additionalProperties": false,
  "properties": {
    "$schema": {
      "type": "string",
      "description": "Editor IntelliSense reference (optional) — relative path ../../../public/schemas/theme.schema.json"
    },
    "id": {
      "type": "string",
      "description": "Theme id — globally unique (stored in app.theme; convention: the plugin's short name)"
    },
    "name": {
      "type": "string",
      "description": "Theme display name — shown in the theme picker and the window title"
    },
    "type": {
      "type": "string",
      "enum": ["light", "dark"],
      "description": "Base light/dark mode — dark is the :root base, light is the data-theme override layer"
    },
    "appearance": {
      "type": "object",
      "description": "Appearance domains (single value, sparse) — an omitted domain inherits the shell's :root default",
      "additionalProperties": false,
      "properties": {
        "radius": {
          "type": "object",
          "description": "Eight radius steps (key = step name, value = px; 999 = full pill)",
          "additionalProperties": false,
          "properties": {
            "xs": { "type": "number" },
            "sm": { "type": "number" },
            "md": { "type": "number" },
            "lg": { "type": "number" },
            "xl": { "type": "number" },
            "2xl": { "type": "number" },
            "pill": { "type": "number" },
            "full": { "type": "number" }
          }
        },
        "glass": {
          "type": "object",
          "description": "Glass and floating panel material (ThemeSurface) — default: no glass, no floating",
          "additionalProperties": false,
          "properties": {
            "type": { "type": "string", "enum": ["glass"], "description": "Glass recipe — default: no glass" },
            "blur": { "type": "number", "description": "Backdrop blur in px — 0 = off" },
            "saturate": { "type": "number", "description": "Saturation boost — 1 = off" },
            "tint": { "type": "string", "description": "Overlay tint color for the glass surface" },
            "opacity": { "type": "number", "description": "Glass surface opacity (compositing baseline) — 1 = opaque / 0 = fully transparent, background shows through" },
            "specular": { "type": "number", "description": "Liquid glass top highlight strength — 0 = off" },
            "specularColor": { "type": "string", "description": "Base color of the top highlight — default: white; alpha still comes from specular" },
            "morph": { "type": "number", "description": "Morph transition in ms — 0 = off" },
            "radius": { "type": "number", "description": "Floating corner radius in px — 0 = square corners flush to the edge" },
            "shadow": { "type": "boolean", "description": "Drop shadow lift — true = floating shadow (maps to --shadow-lift)" },
            "texture": { "type": "string", "description": "Path to a tileable texture image asset (paper texture)" },
            "textureOpacity": { "type": "number", "description": "Texture opacity — 1 = opaque" }
          }
        },
        "font": {
          "type": "object",
          "description": "Font domain — a system font family name or a relative asset path (asset → @font-face → family name)",
          "additionalProperties": false,
          "properties": {
            "ui": { "type": "string", "description": "UI font (--font-ui)" },
            "mono": { "type": "string", "description": "Monospace font (--font-mono)" }
          }
        },
        "background": {
          "type": "object",
          "description": "Image background domain (panorama = full window / zones = sliced)",
          "additionalProperties": false,
          "properties": {
            "image": { "type": "string", "description": "Image path — the author provides a resolvable URL; the engine wraps it in url() when writing --bg-image" },
            "opacity": { "type": "number", "description": "Image layer opacity — 1 = opaque" },
            "mask": { "type": "number", "description": "Image mask darkness (0-1) — 0 = no mask" },
            "maskColor": { "type": "string", "description": "Mask base color — default: black; alpha still comes from mask" },
            "mode": { "type": "string", "enum": ["panorama", "zones"], "description": "Slice mode — panorama (default) / zones (the same image sliced continuously)" }
          }
        }
      }
    },
    "colorways": {
      "type": "array",
      "description": "Colorway list (multi-value color domain, at least one entry)",
      "minItems": 1,
      "items": {
        "type": "object",
        "required": ["id", "name"],
        "additionalProperties": false,
        "properties": {
          "id": { "type": "string", "description": "Colorway id — globally unique (stored in the dynamic app.themeColor enum)" },
          "name": { "type": "string", "description": "Colorway display name" },
          "colors": {
            "type": "object",
            "description": "Color token set (key = contract token name without the -- prefix; value = a color string)",
            "additionalProperties": { "type": "string" }
          }
        }
      }
    }
  }
}
