{
  "id": "mint-soda",
  "name": "薄荷苏打 Mint Soda",
  "type": "light",
  "colorways": [
    {
      "id": "mint-soda",
      "name": "薄荷苏打 Mint Soda",
      "colors": {
        "bg-icon-bar": "#B8ECD6",
        "bg-side-panel": "#E4EBFF",
        "bg-toolbar": "#FFEDDF",
        "bg-window": "#FFFBF5",
        "bg-card": "#FFFFFF",
        "bg-status": "#EDE3FF",
        "bg-input": "#FFFFFF",
        "accent": "#6B4AE0",
        "accent-hover": "#8B6CF0",
        "text-primary": "#382E24",
        "text-secondary": "#7A7268",
        "text-muted": "#8A7A66",
        "border": "#E8E0D8",
        "separator": "#EDE5DD",
        "icon-active": "#6B4AE0",
        "icon-inactive": "#8A7C98",
        "toggle-knob": "#6B4AE0",
        "toggle-knob-on": "#FFFFFF",
        "status-connected": "#34D399",
        "status-disconnected": "#D4C8B8",
        "scrollbar-thumb": "rgba(107, 74, 224, 0.12)",
        "scrollbar-thumb-hover": "rgba(107, 74, 224, 0.22)",
        "tab-hover-bg": "#F5F0E8",
        "drop-indicator": "rgba(107, 74, 224, 0.04)",
        "dirty-dot": "#6B4AE0",
        "context-menu-shadow": "0 4px 16px rgba(56, 46, 36, 0.10)",
        "drag-preview-shadow": "0 4px 20px rgba(56, 46, 36, 0.12)",
        "hover-overlay": "rgba(107, 74, 224, 0.04)",
        "system-log": "#7A7268",
        "sent-echo": "#6B4AE0",
        "received": "#382E24",
        "cm-timestamp": "#A49A90",
        "badge-text": "#FFFFFF",
        "text-on-accent": "#FFFFFF",
        "danger": "#DC2626",
        "error": "#DC2626",
        "warning": "#D97706"
      }
    },
    {
      "id": "mint-dew",
      "name": "薄荷冰露 Mint Dew",
      "colors": {
        "bg-window": "#F2F8FA",
        "bg-card": "#FFFFFF",
        "bg-status": "#0E7490",
        "bg-input": "#FFFFFF",
        "text-primary": "#1A2A2D",
        "text-secondary": "#4E6266",
        "text-muted": "#6E8084",
        "accent": "#0E7490",
        "accent-hover": "#1088A8",
        "border": "#C8D8DE",
        "separator": "#DCE8ED",
        "icon-active": "#0E7490",
        "icon-inactive": "#70848A",
        "system-log": "#4E6266",
        "sent-echo": "#0E7490",
        "received": "#1A2A2D",
        "status-connected": "#34D399",
        "status-disconnected": "#C8D8DE",
        "scrollbar-thumb": "rgba(14, 116, 144, 0.12)",
        "scrollbar-thumb-hover": "rgba(14, 116, 144, 0.22)",
        "tab-hover-bg": "#E6F0F4",
        "drop-indicator": "rgba(14, 116, 144, 0.04)",
        "dirty-dot": "#0E7490",
        "context-menu-shadow": "0 4px 16px rgba(26, 42, 45, 0.08)",
        "drag-preview-shadow": "0 4px 20px rgba(26, 42, 45, 0.10)",
        "bg-icon-bar": "#C4DEE5",
        "bg-side-panel": "#E0EDF2",
        "bg-toolbar": "#E0EDF2",
        "toggle-knob": "#3A4A4E",
        "toggle-knob-on": "#FFFFFF",
        "hover-overlay": "rgba(14, 116, 144, 0.04)",
        "cm-timestamp": "#6E8084",
        "badge-text": "#FFFFFF",
        "text-on-accent": "#FFFFFF",
        "danger": "#DC2626",
        "error": "#DC2626",
        "warning": "#D97706"
      }
    },
    {
      "id": "sea-salt-mint",
      "name": "海盐薄荷 Sea Salt Mint",
      "colors": {
        "bg-window": "#F7F5F0",
        "bg-card": "#FFFFFF",
        "bg-status": "#0F766E",
        "bg-input": "#FFFFFF",
        "text-primary": "#2D2822",
        "text-secondary": "#5E564C",
        "text-muted": "#7E766C",
        "accent": "#0F766E",
        "accent-hover": "#119A8E",
        "border": "#D4CEC4",
        "separator": "#E4DED6",
        "icon-active": "#0F766E",
        "icon-inactive": "#989086",
        "system-log": "#5E564C",
        "sent-echo": "#0F766E",
        "received": "#2D2822",
        "status-connected": "#34D399",
        "status-disconnected": "#D4CEC4",
        "scrollbar-thumb": "rgba(15, 118, 110, 0.12)",
        "scrollbar-thumb-hover": "rgba(15, 118, 110, 0.22)",
        "tab-hover-bg": "#EEE9E0",
        "drop-indicator": "rgba(15, 118, 110, 0.04)",
        "dirty-dot": "#0F766E",
        "context-menu-shadow": "0 4px 16px rgba(45, 40, 34, 0.08)",
        "drag-preview-shadow": "0 4px 20px rgba(45, 40, 34, 0.10)",
        "bg-icon-bar": "#C0D6D0",
        "bg-side-panel": "#E0EAE7",
        "bg-toolbar": "#E0EAE7",
        "toggle-knob": "#4A4238",
        "toggle-knob-on": "#FFFFFF",
        "hover-overlay": "rgba(15, 118, 110, 0.04)",
        "cm-timestamp": "#7E766C",
        "badge-text": "#FFFFFF",
        "text-on-accent": "#FFFFFF",
        "danger": "#DC2626",
        "error": "#DC2626",
        "warning": "#D97706"
      }
    },
    {
      "id": "lime-mint",
      "name": "青柠薄荷 Lime Mint",
      "colors": {
        "bg-window": "#F5FAF2",
        "bg-card": "#FFFFFF",
        "bg-status": "#15803D",
        "bg-input": "#FFFFFF",
        "text-primary": "#1C2A1E",
        "text-secondary": "#4E6250",
        "text-muted": "#6E8270",
        "accent": "#15803D",
        "accent-hover": "#16A34A",
        "border": "#C8D8C8",
        "separator": "#DCE8DC",
        "icon-active": "#15803D",
        "icon-inactive": "#708470",
        "system-log": "#4E6250",
        "sent-echo": "#15803D",
        "received": "#1C2A1E",
        "status-connected": "#34D399",
        "status-disconnected": "#C8D8C8",
        "scrollbar-thumb": "rgba(21, 128, 61, 0.10)",
        "scrollbar-thumb-hover": "rgba(21, 128, 61, 0.20)",
        "tab-hover-bg": "#E6F0E7",
        "drop-indicator": "rgba(21, 128, 61, 0.04)",
        "dirty-dot": "#15803D",
        "context-menu-shadow": "0 4px 16px rgba(28, 42, 30, 0.08)",
        "drag-preview-shadow": "0 4px 20px rgba(28, 42, 30, 0.10)",
        "bg-icon-bar": "#C4DDC8",
        "bg-side-panel": "#E0F0E2",
        "bg-toolbar": "#E0F0E2",
        "toggle-knob": "#3A4A3C",
        "toggle-knob-on": "#FFFFFF",
        "hover-overlay": "rgba(21, 128, 61, 0.04)",
        "cm-timestamp": "#6E8270",
        "badge-text": "#FFFFFF",
        "text-on-accent": "#FFFFFF",
        "danger": "#DC2626",
        "error": "#DC2626",
        "warning": "#D97706"
      }
    }
  ]
}
