{
  "id": "twilight-forest",
  "name": "暮色森林",
  "type": "dark",
  "colorways": [
    {
      "id": "sunset",
      "name": "暮光 Sunset",
      "colors": {
        "bg-window": "#2B2A24",
        "bg-card": "#3D3A32",
        "bg-status": "#807222",
        "bg-input": "#3D3A32",
        "text-primary": "#F5E6C8",
        "text-secondary": "#C4B998",
        "text-muted": "#A89E82",
        "accent": "#807222",
        "accent-hover": "#9E8D2A",
        "border": "#5A5646",
        "separator": "#5A5646",
        "icon-active": "#AA972A",
        "icon-inactive": "#A89E82",
        "system-log": "#A89E82",
        "sent-echo": "#807222",
        "received": "#E8D8A8",
        "status-connected": "#A0C060",
        "status-disconnected": "#8A8678",
        "scrollbar-thumb": "rgba(128, 114, 34, 0.15)",
        "scrollbar-thumb-hover": "rgba(128, 114, 34, 0.25)",
        "tab-hover-bg": "#504C3E",
        "drop-indicator": "rgba(128, 114, 34, 0.06)",
        "dirty-dot": "#AA972A",
        "context-menu-shadow": "0 4px 12px rgba(0, 0, 0, 0.3)",
        "drag-preview-shadow": "0 4px 16px rgba(0, 0, 0, 0.35)",
        "bg-icon-bar": "#2B2922",
        "bg-side-panel": "#37352C",
        "bg-toolbar": "#37352C",
        "toggle-knob": "#FFFFFF",
        "hover-overlay": "rgba(170, 151, 42, 0.08)",
        "cm-timestamp": "#A89E82",
        "badge-text": "#FFFFFF",
        "text-on-accent": "#FFFFFF",
        "danger": "#F87171",
        "error": "#F87171",
        "warning": "#CCA700"
      }
    },
    {
      "id": "teal",
      "name": "青澜 Teal",
      "colors": {
        "bg-window": "#1C2428",
        "bg-card": "#243033",
        "bg-status": "#0B857A",
        "bg-input": "#243033",
        "text-primary": "#E0EDE8",
        "text-secondary": "#99B8AE",
        "text-muted": "#759A8E",
        "accent": "#0B857A",
        "accent-hover": "#0DA698",
        "border": "#364540",
        "separator": "#364540",
        "icon-active": "#0d9488",
        "icon-inactive": "#759A8E",
        "system-log": "#759A8E",
        "sent-echo": "#0B857A",
        "received": "#E0EDE8",
        "status-connected": "#4EC9B0",
        "status-disconnected": "#6A7676",
        "scrollbar-thumb": "rgba(11, 133, 122, 0.15)",
        "scrollbar-thumb-hover": "rgba(11, 133, 122, 0.25)",
        "tab-hover-bg": "#364540",
        "drop-indicator": "rgba(11, 133, 122, 0.06)",
        "dirty-dot": "#0d9488",
        "context-menu-shadow": "0 4px 12px rgba(0, 0, 0, 0.3)",
        "drag-preview-shadow": "0 4px 16px rgba(0, 0, 0, 0.35)",
        "bg-icon-bar": "#1A2224",
        "bg-side-panel": "#243032",
        "bg-toolbar": "#243032",
        "toggle-knob": "#FFFFFF",
        "hover-overlay": "rgba(13, 148, 136, 0.08)",
        "cm-timestamp": "#759A8E",
        "badge-text": "#FFFFFF",
        "text-on-accent": "#FFFFFF",
        "danger": "#F87171",
        "error": "#F87171",
        "warning": "#CCA700"
      }
    },
    {
      "id": "twilight-purple",
      "name": "暮紫 Twilight Purple",
      "colors": {
        "bg-window": "#1E1B2E",
        "bg-card": "#2A2538",
        "bg-status": "#5C2BE0",
        "bg-input": "#2A2538",
        "text-primary": "#E8E0F0",
        "text-secondary": "#B0A0C8",
        "text-muted": "#8A7E9E",
        "accent": "#5C2BE0",
        "accent-hover": "#7B52F0",
        "border": "#3E3648",
        "separator": "#3E3648",
        "icon-active": "#8B6CF0",
        "icon-inactive": "#8A7E9E",
        "system-log": "#8A7E9E",
        "sent-echo": "#5C2BE0",
        "received": "#E8E0F0",
        "status-connected": "#6BC080",
        "status-disconnected": "#6A6A7A",
        "scrollbar-thumb": "rgba(92, 43, 224, 0.15)",
        "scrollbar-thumb-hover": "rgba(92, 43, 224, 0.25)",
        "tab-hover-bg": "#3E3648",
        "drop-indicator": "rgba(92, 43, 224, 0.06)",
        "dirty-dot": "#5C2BE0",
        "context-menu-shadow": "0 4px 12px rgba(0, 0, 0, 0.3)",
        "drag-preview-shadow": "0 4px 16px rgba(0, 0, 0, 0.35)",
        "bg-icon-bar": "#1E1A2C",
        "bg-side-panel": "#2B273C",
        "bg-toolbar": "#2B273C",
        "toggle-knob": "#FFFFFF",
        "hover-overlay": "rgba(92, 43, 224, 0.08)",
        "cm-timestamp": "#8A7E9E",
        "badge-text": "#FFFFFF",
        "text-on-accent": "#FFFFFF",
        "danger": "#F87171",
        "error": "#F87171",
        "warning": "#CCA700"
      }
    },
    {
      "id": "verdant",
      "name": "翠微 Verdant",
      "colors": {
        "bg-window": "#1A241C",
        "bg-card": "#233026",
        "bg-status": "#158625",
        "bg-input": "#233026",
        "text-primary": "#E0EDE2",
        "text-secondary": "#A0C8A8",
        "text-muted": "#7A9E84",
        "accent": "#158625",
        "accent-hover": "#1BAA30",
        "border": "#354A38",
        "separator": "#354A38",
        "icon-active": "#1FC035",
        "icon-inactive": "#7A9E84",
        "system-log": "#7A9E84",
        "sent-echo": "#158625",
        "received": "#E0EDE2",
        "status-connected": "#1FC035",
        "status-disconnected": "#6A7A6A",
        "scrollbar-thumb": "rgba(21, 134, 37, 0.15)",
        "scrollbar-thumb-hover": "rgba(21, 134, 37, 0.25)",
        "tab-hover-bg": "#304536",
        "drop-indicator": "rgba(21, 134, 37, 0.06)",
        "dirty-dot": "#1FC035",
        "context-menu-shadow": "0 4px 12px rgba(0, 0, 0, 0.3)",
        "drag-preview-shadow": "0 4px 16px rgba(0, 0, 0, 0.35)",
        "bg-icon-bar": "#1C281E",
        "bg-side-panel": "#243028",
        "bg-toolbar": "#243028",
        "toggle-knob": "#FFFFFF",
        "hover-overlay": "rgba(21, 134, 37, 0.08)",
        "cm-timestamp": "#7A9E84",
        "badge-text": "#FFFFFF",
        "text-on-accent": "#FFFFFF",
        "danger": "#F87171",
        "error": "#F87171",
        "warning": "#CCA700"
      }
    }
  ]
}
