{
  "$schema": "../../../public/schemas/theme.schema.json",
  "id": "theme-aurora-glass.aurora-glass",
  "name": "极光玻璃 Aurora Glass",
  "type": "dark",
  "appearance": {
    "glass": {
      "type": "glass",
      "blur": 24,
      "saturate": 1.25,
      "tint": "rgba(59, 77, 148, 0.35)",
      "opacity": 0.275,
      "specular": 0.6,
      "morph": 200,
      "radius": 12,
      "shadow": true
    },
    "background": {
      "image": "linkdesk://theme-aurora-glass/resources/aurora-bg.svg",
      "opacity": 0.9,
      "mask": 0.3
    }
  },
  "colorways": [
    {
      "id": "theme-aurora-glass.aurora",
      "name": "极光紫",
      "colors": {
        "bg-titlebar": "rgba(16, 26, 51, 0.55)",
        "bg-window": "rgba(11, 16, 32, 0.55)",
        "bg-card": "rgba(22, 32, 62, 0.55)",
        "bg-status": "rgba(14, 22, 48, 0.55)",
        "bg-input": "rgba(26, 36, 71, 0.55)",
        "bg-icon-bar": "rgba(15, 26, 48, 0.55)",
        "bg-side-panel": "rgba(17, 28, 56, 0.55)",
        "bg-toolbar": "rgba(16, 26, 51, 0.55)",
        "text-primary": "#F1F5FF",
        "text-secondary": "#A5B4E0",
        "text-muted": "#7E8CBB",
        "accent": "#7C3AED",
        "accent-hover": "#8B5CF6",
        "border": "rgba(255, 255, 255, 0.08)",
        "separator": "rgba(255, 255, 255, 0.06)",
        "icon-active": "#A78BFA",
        "icon-inactive": "#6B77A8",
        "toggle-knob": "#7C3AED",
        "toggle-knob-on": "#FFFFFF",
        "status-connected": "#2DD4BF",
        "status-disconnected": "#64748B",
        "scrollbar-thumb": "rgba(124, 58, 237, 0.35)",
        "scrollbar-thumb-hover": "rgba(124, 58, 237, 0.50)",
        "tab-hover-bg": "rgba(255, 255, 255, 0.06)",
        "drop-indicator": "rgba(124, 58, 237, 0.30)",
        "dirty-dot": "#A78BFA",
        "context-menu-shadow": "0 8px 32px rgba(2, 6, 18, 0.50)",
        "drag-preview-shadow": "0 8px 40px rgba(2, 6, 18, 0.60)",
        "hover-overlay": "rgba(255, 255, 255, 0.05)",
        "system-log": "#7E8CBB",
        "sent-echo": "#8B5CF6",
        "received": "#F1F5FF",
        "cm-timestamp": "#5B6890",
        "badge-text": "#FFFFFF",
        "text-on-accent": "#FFFFFF",
        "danger": "#F87171",
        "error": "#F87171",
        "warning": "#FBBF24"
      }
    }
  ]
}
