{
  "$schema": "../../../public/schemas/theme.schema.json",
  "id": "theme-zones.image-zones",
  "name": "影像分区 Image Zones",
  "type": "dark",
  "appearance": {
    "glass": {
      "radius": 8
    },
    "background": {
      "mode": "zones",
      "image": "linkdesk://theme-zones/resources/zones-bg.svg",
      "opacity": 0.95
    }
  },
  "colorways": [
    {
      "id": "theme-zones.image",
      "name": "影像区",
      "colors": {
        "bg-window": "rgba(18, 16, 12, 0.55)",
        "bg-card": "rgba(27, 24, 19, 0.55)",
        "bg-status": "rgba(20, 17, 12, 0.55)",
        "bg-input": "rgba(34, 29, 22, 0.55)",
        "bg-icon-bar": "rgba(20, 17, 12, 0.55)",
        "bg-side-panel": "rgba(24, 20, 16, 0.55)",
        "bg-toolbar": "rgba(23, 19, 14, 0.55)",
        "text-primary": "#F2EDE3",
        "text-secondary": "#B5AB97",
        "text-muted": "#877C68",
        "accent": "#E8923C",
        "accent-hover": "#F0A554",
        "border": "rgba(242, 237, 227, 0.09)",
        "separator": "rgba(242, 237, 227, 0.06)",
        "icon-active": "#F2EDE3",
        "icon-inactive": "#6E6350",
        "toggle-knob": "#E8923C",
        "toggle-knob-on": "#FFFFFF",
        "status-connected": "#86C36A",
        "status-disconnected": "#6E6350",
        "scrollbar-thumb": "rgba(232, 146, 60, 0.30)",
        "scrollbar-thumb-hover": "rgba(232, 146, 60, 0.45)",
        "tab-hover-bg": "rgba(242, 237, 227, 0.06)",
        "drop-indicator": "rgba(232, 146, 60, 0.30)",
        "dirty-dot": "#E8923C",
        "context-menu-shadow": "0 8px 32px rgba(10, 8, 5, 0.55)",
        "drag-preview-shadow": "0 8px 40px rgba(10, 8, 5, 0.65)",
        "hover-overlay": "rgba(242, 237, 227, 0.04)",
        "system-log": "#877C68",
        "sent-echo": "#F0A554",
        "received": "#F2EDE3",
        "cm-timestamp": "#877C68",
        "badge-text": "#FFFFFF",
        "text-on-accent": "#1A140D",
        "danger": "#F87171",
        "error": "#F87171",
        "warning": "#E8923C"
      }
    }
  ]
}
