{
  "$schema": "../../../public/schemas/theme.schema.json",
  "id": "paper-zones",
  "name": "纸纹分区 Paper Zones",
  "type": "light",
  "appearance": {
    "glass": {
      "texture": "linkdesk://theme-zones/resources/paper-texture.svg",
      "textureOpacity": 0.45,
      "radius": 8
    }
  },
  "colorways": [
    {
      "id": "kraft",
      "name": "纸纹区",
      "colors": {
        "bg-window": "#ECE7DC",
        "bg-card": "#E8E2D4",
        "bg-status": "#E4DECF",
        "bg-input": "#F2EEE4",
        "bg-icon-bar": "#E4DECF",
        "bg-side-panel": "#EAE4D6",
        "bg-toolbar": "#E8E2D4",
        "text-primary": "#2B2721",
        "text-secondary": "#5C5545",
        "text-muted": "#8C8472",
        "accent": "#B45309",
        "accent-hover": "#C2661A",
        "border": "rgba(43, 39, 33, 0.12)",
        "separator": "rgba(43, 39, 33, 0.08)",
        "icon-active": "#2B2721",
        "icon-inactive": "#9A9180",
        "toggle-knob": "#B45309",
        "toggle-knob-on": "#FFFFFF",
        "status-connected": "#4D7C0F",
        "status-disconnected": "#9A9180",
        "scrollbar-thumb": "rgba(180, 83, 9, 0.30)",
        "scrollbar-thumb-hover": "rgba(180, 83, 9, 0.45)",
        "tab-hover-bg": "rgba(43, 39, 33, 0.07)",
        "drop-indicator": "rgba(180, 83, 9, 0.30)",
        "dirty-dot": "#B45309",
        "context-menu-shadow": "0 8px 32px rgba(43, 39, 33, 0.22)",
        "drag-preview-shadow": "0 8px 40px rgba(43, 39, 33, 0.28)",
        "hover-overlay": "rgba(43, 39, 33, 0.05)",
        "system-log": "#8C8472",
        "sent-echo": "#C2661A",
        "received": "#2B2721",
        "cm-timestamp": "#8C8472",
        "badge-text": "#FFFFFF",
        "text-on-accent": "#FFFFFF",
        "danger": "#B3261E",
        "error": "#B3261E",
        "warning": "#B45309"
      }
    }
  ]
}
