{
  "id": "light",
  "name": "Light",
  "type": "light",
  "colorways": [
    {
      "id": "light",
      "name": "Light",
      "colors": {
        "bg-window": "#FFFFFF",
        "bg-card": "#F5F5F5",
        "bg-status": "#007ACC",
        "bg-input": "#FFFFFF",
        "text-primary": "#2D2D2D",
        "text-secondary": "#5A5A5A",
        "text-muted": "#767676",
        "accent": "#0078D4",
        "accent-hover": "#106EBE",
        "text-on-accent": "#FFFFFF",
        "border": "#D4D4D4",
        "separator": "#E8E8E8",
        "icon-active": "#2D2D2D",
        "icon-inactive": "#767676",
        "system-log": "#767676",
        "sent-echo": "#0078D4",
        "received": "#2D2D2D",
        "status-connected": "#388A34",
        "status-disconnected": "#999999",
        "scrollbar-thumb": "rgba(0, 0, 0, 0.15)",
        "scrollbar-thumb-hover": "rgba(0, 0, 0, 0.25)",
        "tab-hover-bg": "#E8E8E8",
        "drop-indicator": "rgba(0, 0, 0, 0.06)",
        "dirty-dot": "#D4A017",
        "context-menu-shadow": "0 4px 12px rgba(0, 0, 0, 0.12)",
        "drag-preview-shadow": "0 4px 16px rgba(0, 0, 0, 0.15)",
        "bg-icon-bar": "#F0F0F0",
        "bg-side-panel": "#F5F5F5",
        "bg-toolbar": "#F5F5F5",
        "bg-titlebar": "#DDDDDD",
        "titlebar-close-hover": "#C42B1C",
        "toggle-knob": "#2D2D2D",
        "hover-overlay": "rgba(0, 0, 0, 0.04)",
        "cm-timestamp": "#767676"
      }
    },
    {
      "id": "dark",
      "name": "Dark",
      "colors": {
        "bg-window": "#1E1E1E",
        "bg-card": "#2D2D2D",
        "bg-status": "#007ACC",
        "bg-input": "#3C3C3C",
        "text-primary": "#D4D4D4",
        "text-secondary": "#9D9D9D",
        "text-muted": "#8A8A8A",
        "accent": "#0E639C",
        "accent-hover": "#1177BB",
        "text-on-accent": "#FFFFFF",
        "border": "#3C3C3C",
        "separator": "#474747",
        "icon-active": "#FFFFFF",
        "icon-inactive": "#858585",
        "system-log": "#8A8A8A",
        "sent-echo": "#0E639C",
        "received": "#D4D4D4",
        "status-connected": "#4EC9B0",
        "status-disconnected": "#6A6A6A",
        "scrollbar-thumb": "rgba(255, 255, 255, 0.15)",
        "scrollbar-thumb-hover": "rgba(255, 255, 255, 0.25)",
        "tab-hover-bg": "#353535",
        "drop-indicator": "rgba(255, 255, 255, 0.06)",
        "dirty-dot": "#CCA700",
        "context-menu-shadow": "0 4px 12px rgba(0, 0, 0, 0.3)",
        "drag-preview-shadow": "0 4px 16px rgba(0, 0, 0, 0.35)",
        "bg-icon-bar": "#18181B",
        "bg-side-panel": "#1E1E22",
        "bg-toolbar": "#1E1E22",
        "bg-titlebar": "#252526",
        "titlebar-close-hover": "#C42B1C",
        "toggle-knob": "#FFFFFF",
        "hover-overlay": "rgba(255, 255, 255, 0.06)",
        "cm-timestamp": "#8A8A8A"
      }
    }
  ]
}
